{
  "schemaVersion": 1,
  "id": "quorum",
  "title": "Dry-run: quorum reads and writes",
  "intro": "About 6 minutes. The coordinator is twenty lines. Spend your time on why R + W > N works and what happens when replicas disagree.",
  "language": "javascript",
  "steps": [
    {
      "title": "Write the rule down before any code",
      "kind": "code",
      "explain": "State the inequality and the pigeonhole argument behind it. If the read set and the write set together exceed the replica count they must overlap, so a read cannot miss the newest acknowledged write.",
      "saysOutLoud": "R plus W greater than N means the read set and write set must share a replica.",
      "code": "// N = replicas per key\n// W = acks required before a write is confirmed\n// R = replicas consulted on a read\n//\n//   R + W > N  ⟹  read set ∩ write set ≠ ∅  ⟹  strong consistency\n//\n// N=3, W=2, R=2 → 4 > 3 ✓  and survives one node down on either path\nconst N = 3, W = 2, R = 2;\n"
    },
    {
      "title": "Any node can coordinate",
      "kind": "code",
      "explain": "There is no primary. Whichever node the client reaches coordinates that operation, which removes the single point of failure and all the failover machinery a primary would need. The replica set for a key comes from the hash ring.",
      "code": "function replicasFor(key) {\n  return ring.preferenceList(key, N);   // N distinct physical nodes\n}\n\n// The node the client happened to reach becomes the coordinator.\n// No leader election, no failover — that's the Dynamo-style trade.\n"
    },
    {
      "title": "The quorum write",
      "kind": "code",
      "explain": "Send to all N, resolve as soon as W succeed. Latency is set by the second-fastest replica rather than the slowest, which is why a straggler does not slow the system — worth saying, because it is not obvious.",
      "saysOutLoud": "I wait for W acks, not all N, so one slow replica doesn't slow the write.",
      "code": "async function put(key, value) {\n  const version = { node: SELF, counter: Date.now() };\n  const writes = replicasFor(key).map((n) => n.put(key, value, version));\n\n  let ok = 0;\n  await new Promise((resolve, reject) => {\n    writes.forEach((p) => p.then(\n      () => { if (++ok === W) resolve(); },\n      () => { if (writes.length - ok < W) reject(new Error('quorum lost')); },\n    ));\n  });\n\n  return version;   // remaining replicas continue in the background\n}\n"
    },
    {
      "title": "The quorum read, and picking a winner",
      "kind": "code",
      "explain": "Reading R replicas guarantees the newest value is among the responses — but you still have to identify it. Comparing versions is a separate step from reaching quorum, and conflating the two is a common slip.",
      "code": "async function get(key) {\n  const nodes = replicasFor(key);\n  const replies = await anyOf(nodes.map((n) => n.get(key)), R);\n\n  // quorum guarantees the newest is HERE; it doesn't tell you which\n  let winner = replies[0];\n  for (const r of replies) {\n    if (descendsFrom(r.version, winner.version)) winner = r;\n  }\n\n  repairStale(key, winner, replies);   // background, off the read path\n  return winner.value;\n}\n"
    },
    {
      "title": "Repair the replicas you actually read",
      "kind": "code",
      "explain": "Read repair fixes the stale replicas that appeared in this read's responses — not the ones you skipped. That distinction matters, because it means read repair alone never fixes keys nobody reads.",
      "saysOutLoud": "Read repair only touches replicas that answered. Cold keys need something else.",
      "code": "function repairStale(key, winner, replies) {\n  for (const r of replies) {\n    if (r.version !== winner.version) {\n      r.node.put(key, winner.value, winner.version).catch(() => {});\n    }\n  }\n}\n"
    },
    {
      "title": "Anti-entropy covers the keys nobody reads",
      "kind": "infra",
      "explain": "Replicas periodically exchange Merkle trees of their key ranges and descend only where the hashes differ, so reconciling transfers a handful of hashes instead of the whole dataset. This is what actually delivers the 'eventually' in eventual consistency for cold data, and it runs continuously in the background rather than on the request path."
    },
    {
      "title": "Detect genuine conflicts instead of guessing",
      "kind": "code",
      "explain": "Two clients writing through different coordinators during a partition produce versions with no ordering between them. Vector clocks tell you they are concurrent rather than ordered — the value is the detection, because last-write-wins by timestamp silently discards one update.",
      "code": "// concurrent  → neither descends from the other → a REAL conflict\nfunction descendsFrom(a, b) {\n  return Object.keys(b).every((node) => (a[node] ?? 0) >= (b[node] ?? 0));\n}\n\n// Resolution is a POLICY choice, not a technical one:\n//   last-write-wins → simple, silently loses an update, trusts clocks\n//   return both     → the cart model: union the items\n//   CRDT           → merge defined so concurrency always converges\n"
    },
    {
      "title": "Turn the dial per operation",
      "kind": "code",
      "explain": "The strongest version of this answer ties the setting to the product rather than the database. Same store, two settings, each justified by what breaks when the data is stale.",
      "saysOutLoud": "The cart reads at R=2 so users see their own writes; recommendations read at R=1.",
      "code": "await get('cart:42',      { R: 2 });  // must see the user's own write\nawait get('recs:42',      { R: 1 });  // stale suggestion is invisible\nawait put('inventory:99', { W: 3 });  // overselling costs real money\n\n// W=1,R=1 → fastest, eventually consistent (2 ≯ 3)\n// W=3     → strongly consistent reads at R=1, but ONE node down\n//           blocks every write. Availability traded explicitly.\n"
    }
  ],
  "closing": "If they ask about hinted handoff: a write for a node that is down is held by a peer with a hint and forwarded on recovery, so short outages don't drop writes or fail the quorum."
}
