{
  "schemaVersion": 1,
  "id": "token-bucket",
  "title": "Dry-run: a distributed token-bucket limiter",
  "intro": "Build it in the order you would at a whiteboard: the algorithm alone first, then the part that makes it correct across many servers. Roughly 6 minutes if you talk while you type.",
  "language": "javascript",
  "steps": [
    {
      "title": "State the shape before writing anything",
      "kind": "code",
      "explain": "Start by naming what you store per client. Two numbers is the whole state — that is the selling point of token bucket, and saying it up front tells the interviewer you know why you picked it.",
      "saysOutLoud": "Per client I only need a token count and the time I last refilled. Everything else is derived.",
      "code": "// Per-client state. That's it — two numbers.\n// { tokens: number, lastRefillMs: number }\n\nconst LIMIT = 100;        // bucket capacity  → burst tolerance\nconst REFILL_PER_SEC = 10; // sustained rate\n"
    },
    {
      "title": "Refill lazily, never on a timer",
      "kind": "code",
      "explain": "A background timer per client would be thousands of timers. Instead compute how much time has passed and top up on access. This is the trick worth pointing out — it makes the algorithm O(1) memory and needs no scheduler.",
      "saysOutLoud": "I refill lazily on read rather than running a timer per bucket.",
      "code": "function refill(state, nowMs) {\n  const elapsedSec = (nowMs - state.lastRefillMs) / 1000;\n  const topUp = elapsedSec * REFILL_PER_SEC;\n\n  return {\n    tokens: Math.min(LIMIT, state.tokens + topUp), // never exceed capacity\n    lastRefillMs: nowMs,\n  };\n}\n"
    },
    {
      "title": "The single-node decision",
      "kind": "code",
      "explain": "Now the actual allow/deny. Note it returns the remaining count too — you need that for the response headers, and volunteering that detail shows you have shipped one of these.",
      "code": "function tryConsume(state, nowMs) {\n  const s = refill(state, nowMs);\n\n  if (s.tokens < 1) {\n    const waitSec = (1 - s.tokens) / REFILL_PER_SEC;\n    return { allowed: false, state: s, retryAfterSec: Math.ceil(waitSec) };\n  }\n\n  return {\n    allowed: true,\n    state: { ...s, tokens: s.tokens - 1 },\n    remaining: Math.floor(s.tokens - 1),\n  };\n}\n"
    },
    {
      "title": "Now break it on purpose",
      "kind": "code",
      "explain": "Say plainly that the code above is wrong the moment there are two gateway nodes. Read-then-write across a shared store lets two nodes read the same 99 and both allow. Showing the bug before fixing it is what separates a memorised answer from a designed one.",
      "saysOutLoud": "This is correct on one box and quietly wrong on ten — let me show the race.",
      "code": "// TWO gateway nodes, one shared Redis, same client:\n//\n//   node A: GET bucket → 1 token left\n//   node B: GET bucket → 1 token left   ← same value\n//   node A: SET tokens = 0   → ALLOW\n//   node B: SET tokens = 0   → ALLOW    ← over-admitted\n//\n// Over-admission scales with node count, and it happens\n// hardest under the exact load you were defending against.\n"
    },
    {
      "title": "Redis holds the shared counter",
      "kind": "infra",
      "explain": "This is a dependency you configure, not a component you build. What matters is naming the cost out loud: every request now takes a network round trip (~0.5–2 ms in-datacenter), and Redis becomes a hard dependency of every request your system serves.",
      "saysOutLoud": "The counter has to be shared, so I'm accepting a round trip on every request and a new dependency."
    },
    {
      "title": "Make the check atomic with a Lua script",
      "kind": "code",
      "explain": "Redis runs a script atomically, so the read-modify-write of both fields happens with no interleaving. This is the standard production answer for token bucket and the thing to name explicitly — INCR alone can't do it because you need to update two fields together.",
      "code": "const SCRIPT = `\n  local tokens = tonumber(redis.call('HGET', KEYS[1], 'tokens') or ARGV[1])\n  local last   = tonumber(redis.call('HGET', KEYS[1], 'last')   or ARGV[4])\n  local now, rate, cap = tonumber(ARGV[4]), tonumber(ARGV[2]), tonumber(ARGV[1])\n\n  tokens = math.min(cap, tokens + ((now - last) / 1000) * rate)\n\n  if tokens < 1 then return {0, 0} end\n\n  redis.call('HSET', KEYS[1], 'tokens', tokens - 1, 'last', now)\n  redis.call('EXPIRE', KEYS[1], ARGV[3])\n  return {1, math.floor(tokens - 1)}\n`;\n\nasync function allow(redis, clientId) {\n  const [ok, remaining] = await redis.eval(\n    SCRIPT, 1, `rl:${clientId}`,\n    LIMIT, REFILL_PER_SEC, 3600, Date.now()\n  );\n  return { allowed: ok === 1, remaining };\n}\n"
    },
    {
      "title": "Decide what happens when Redis is down",
      "kind": "code",
      "explain": "Interviewers listen for this. A limiter outage must not become an API outage — so fail open for general traffic. The exception is auth endpoints, where allowing unlimited attempts is worse than rejecting real users. Answer per endpoint class, not globally.",
      "saysOutLoud": "Fail open, except on auth endpoints where I fail closed.",
      "code": "async function middleware(req, res, next) {\n  try {\n    const { allowed, remaining } = await allow(redis, keyFor(req));\n\n    res.set('X-RateLimit-Limit', LIMIT);\n    res.set('X-RateLimit-Remaining', remaining);\n\n    if (!allowed) {\n      // jitter so throttled clients don't all return in the same millisecond\n      res.set('Retry-After', 1 + Math.floor(Math.random() * 5));\n      return res.status(429).json({ error: 'rate limited' });\n    }\n    next();\n  } catch (err) {\n    // Redis unreachable: fail OPEN so a limiter outage isn't an API outage.\n    if (isAuthEndpoint(req)) return res.status(503).end(); // ...except here\n    next();\n  }\n}\n"
    }
  ],
  "closing": "If asked to scale it further: batch by leasing 20 tokens at a time per node, which cuts round trips 20× and costs you a little over-admission. Name the trade rather than claiming exactness."
}
