{
  "schemaVersion": 1,
  "id": "upload-transcode",
  "title": "Dry-run: direct upload and async transcoding",
  "intro": "About 5 minutes. The app server never touches file bytes — that single decision shapes everything else here.",
  "language": "javascript",
  "steps": [
    {
      "title": "Never proxy the bytes through your API",
      "kind": "code",
      "explain": "Routing a video upload through the app server ties up a request thread for the whole transfer and burns bandwidth you're paying for twice. The API's only job is to issue a short-lived signed URL; the client uploads straight to object storage.",
      "saysOutLoud": "The app server issues a permission slip, it never sees the file itself.",
      "code": "async function requestUpload(userId, filename, contentType) {\n  const key = `uploads/${userId}/${ids.next()}-${filename}`;\n\n  const url = await storage.presign({\n    key, contentType, method: 'PUT', expiresIn: 300,\n  });\n\n  await db.uploads.insert({ key, userId, status: 'pending' });\n  return { uploadUrl: url, key };\n}\n"
    },
    {
      "title": "Large files upload in parts, not one PUT",
      "kind": "code",
      "explain": "A single-request upload dies on any network blip and restarts from zero. Multipart upload splits the file into chunks the client can retry independently, and only the failed chunk needs resending.",
      "code": "async function initMultipart(key, contentType) {\n  const { uploadId } = await storage.createMultipartUpload({ key, contentType });\n  return uploadId;   // client requests a presigned URL per part, per this id\n}\n\nasync function completeMultipart(key, uploadId, parts) {\n  // parts: [{ partNumber, etag }, ...] returned by each part's PUT\n  return storage.completeMultipartUpload({ key, uploadId, parts });\n}\n"
    },
    {
      "title": "Storage fires an event; the app never polls",
      "kind": "infra",
      "explain": "Object storage emits an event on object-created directly to a queue. The app doesn't poll storage asking 'is it done yet' — it reacts to the event, which also means the upload can succeed even if the app server is temporarily down."
    },
    {
      "title": "The transcode job is a fan-out to multiple renditions",
      "kind": "code",
      "explain": "One upload becomes several outputs — a few resolutions, maybe a thumbnail — because different clients and network conditions need different bitrates. Each rendition is its own job so one failing (say, 4K on a slow encoder) doesn't block the others from going live.",
      "code": "async function onUploadComplete(key) {\n  const renditions = ['1080p', '720p', '480p', 'thumbnail'];\n\n  await Promise.all(renditions.map((r) =>\n    jobs.enqueue('transcode', { sourceKey: key, rendition: r })\n  ));\n}\n"
    },
    {
      "title": "Transcoding itself runs outside the app entirely",
      "kind": "infra",
      "explain": "Actual encoding (ffmpeg or a managed service like MediaConvert) is CPU-bound and can take minutes — nothing an API request should ever wait on. Workers pull transcode jobs from the queue, write each output back to storage under a predictable key, and mark that rendition ready independently."
    },
    {
      "title": "Serve only what's marked ready",
      "kind": "code",
      "explain": "The player has to handle 'video exists but 1080p isn't done yet' as a normal state, not an error — falling back to whatever rendition is currently available rather than erroring out or blocking on the highest quality.",
      "code": "async function playbackUrl(mediaId, preferred) {\n  const ready = await db.renditions.ready(mediaId);   // e.g. ['480p','thumbnail']\n  const rendition = ready.includes(preferred) ? preferred : ready[0];\n  if (!rendition) return null;   // still processing, show a placeholder\n\n  return cdn.urlFor(mediaId, rendition);\n}\n"
    }
  ],
  "closing": "If they ask about failed uploads: the presigned URL expires and the pending row never flips to complete, so a cleanup job sweeping 'pending for over 24h' is enough — no special-case error handling needed on the happy path."
}
