{
  "schemaVersion": 1,
  "id": "snowflake",
  "title": "Dry-run: a Snowflake-style ID generator",
  "intro": "About 5 minutes. The whole generator is three shifts and two ORs — the interesting parts are the two failure modes you handle around it.",
  "language": "javascript",
  "steps": [
    {
      "title": "Lay out the 64 bits before writing code",
      "kind": "code",
      "explain": "Draw the layout first and justify each field. The sign bit is deliberate — many languages have no unsigned 64-bit type, so a leading 1 would make the ID negative in Java and break every boundary it crosses.",
      "saysOutLoud": "One sign bit, 41 of timestamp, 10 of machine, 12 of sequence.",
      "code": "// 1 | 41 timestamp ms | 10 machine | 12 sequence\n//\n//  41 bits ms   ≈ 69 years from a custom epoch\n//  10 bits      = 1,024 generators\n//  12 bits      = 4,096 per ms → ~4.1M IDs/sec/machine\n\nconst EPOCH = 1700000000000; // custom, not 1970 — buys the full 69 years\nconst MACHINE_BITS = 10, SEQ_BITS = 12;\nconst MAX_SEQ = (1 << SEQ_BITS) - 1; // 4095\n"
    },
    {
      "title": "The generator itself",
      "kind": "code",
      "explain": "BigInt because the value exceeds 53 bits and would silently lose precision as a JS number — worth saying out loud, it is a real bug people hit. Note there is no network call anywhere in this function.",
      "code": "let lastMs = -1, seq = 0;\n\nfunction nextId(machineId) {\n  let now = Date.now();\n\n  if (now === lastMs) {\n    seq = (seq + 1) & MAX_SEQ;\n    if (seq === 0) now = waitNextMs(lastMs); // exhausted this ms\n  } else {\n    seq = 0;\n  }\n  lastMs = now;\n\n  return (BigInt(now - EPOCH) << BigInt(MACHINE_BITS + SEQ_BITS))\n       | (BigInt(machineId) << BigInt(SEQ_BITS))\n       | BigInt(seq);\n}\n"
    },
    {
      "title": "Handle the clock moving backwards",
      "kind": "code",
      "explain": "This is the failure that turns a clever scheme into duplicate primary keys, and interviewers wait for it. NTP steps, VM resume, and manual fixes all rewind clocks. Advancing monotonically from the last issued timestamp keeps IDs unique; the embedded time is briefly ahead of reality, which nobody cares about.",
      "saysOutLoud": "I never trust the wall clock directly — I advance monotonically from the last value I issued.",
      "code": "function monotonicNow() {\n  const wall = Date.now();\n\n  if (wall < lastMs) {\n    const drift = lastMs - wall;\n    if (drift > 5000) throw new Error(`clock regressed ${drift}ms — refusing`);\n    return lastMs; // small rewind: keep issuing, let sequence absorb it\n  }\n  return wall;\n}\n"
    },
    {
      "title": "Machine IDs come from the platform",
      "kind": "infra",
      "explain": "The one piece of genuine coordination, and where deployments actually break. Two generators sharing a machine ID produce identical IDs whenever their clocks and sequences align. A ZooKeeper or etcd ephemeral lease claims the lowest free id and releases it if the process dies; a Kubernetes StatefulSet ordinal gives it to you free. Static config is fine at small scale and quietly dangerous at large, because someone will copy a config file."
    },
    {
      "title": "Decoding is free, and that cuts both ways",
      "kind": "code",
      "explain": "Because fields are positional, an ID is self-describing — given one from a bug report you know when and where it was made with no database lookup. The flip side is that it leaks creation time and generation rate, so use a separate opaque identifier for anything user-facing where enumeration matters.",
      "code": "function decode(id) {\n  const seq       = id & BigInt(MAX_SEQ);\n  const machine   = (id >> BigInt(SEQ_BITS)) & BigInt((1 << MACHINE_BITS) - 1);\n  const timestamp = (id >> BigInt(MACHINE_BITS + SEQ_BITS)) + BigInt(EPOCH);\n\n  return { at: new Date(Number(timestamp)), machine: Number(machine), seq: Number(seq) };\n}\n"
    },
    {
      "title": "Be precise about the ordering guarantee",
      "kind": "code",
      "explain": "IDs sort by time within a machine and only approximately across machines — two generators in the same millisecond order by machine id, not by what actually happened first. That is fine for feeds and pagination, and saying where it is not fine is the mark of understanding rather than recall.",
      "code": "// Sortable ENOUGH for:  feed pagination, cursor paging, debugging\n// NOT sufficient for:   causal ordering, financial sequencing\n//\n// Those need logical clocks or a consensus sequencer — far more\n// expensive than three bit shifts.\n"
    }
  ],
  "closing": "If machine-ID assignment is impossible in your environment — some serverless platforms — offer UUIDv7 instead: time-ordered like Snowflake, zero coordination, at 128 bits rather than 64."
}
