{
  "schemaVersion": 1,
  "id": "failover",
  "title": "Dry-run: active-passive failover",
  "intro": "About 5 minutes. The mechanics of promoting a replica are easy — the hard part is making sure two nodes never both think they're primary.",
  "language": "javascript",
  "steps": [
    {
      "title": "Health checks decide when to failover, not humans",
      "kind": "code",
      "explain": "A monitor pings the primary on a short interval. One missed check is noise — a network blip, a GC pause — so failover triggers only after several consecutive failures, trading a few seconds of detection delay for not failing over on a false alarm.",
      "code": "let misses = 0;\nconst THRESHOLD = 3;\n\nsetInterval(async () => {\n  const ok = await ping(primary, { timeoutMs: 1000 });\n  misses = ok ? 0 : misses + 1;\n  if (misses >= THRESHOLD) triggerFailover();\n}, 2000);\n"
    },
    {
      "title": "The naive promotion — races with the old primary",
      "kind": "code",
      "explain": "Just telling the replica 'you're primary now' is broken if the old primary is actually still alive — maybe it was a network partition on the monitor's side, not a real crash. Both nodes would now accept writes.",
      "code": "// NAIVE: assumes the old primary is definitely dead. It might not be.\nfunction triggerFailoverNaive() {\n  replica.promote();\n  router.pointWritesTo(replica);\n}\n"
    },
    {
      "title": "Fix: fence the old primary before promoting",
      "kind": "code",
      "explain": "Fencing means making the old primary provably unable to accept writes before the new one starts — revoke its access token, pull its network route, or have it self-check a lease and step down. Only after fencing succeeds does promotion happen, closing the split-brain window.",
      "saysOutLoud": "I promote only after the old primary is fenced, not just presumed dead.",
      "code": "async function triggerFailover() {\n  const fenced = await fence(primary);       // revoke creds / cut route\n  if (!fenced) throw new Error('cannot safely fail over: fence unconfirmed');\n\n  await replica.promote();\n  await router.pointWritesTo(replica);\n}\n"
    },
    {
      "title": "A lease makes the primary self-demote if isolated",
      "kind": "code",
      "explain": "Instead of relying only on an external fence, the primary itself holds a renewable lease from a coordination service. If it can't renew — because it's the one that's actually partitioned — it stops accepting writes on its own, which is a second independent guard against split brain.",
      "code": "async function renewLeaseLoop() {\n  while (true) {\n    const ok = await coordinator.renew(myLeaseId, { ttl: 5000 });\n    if (!ok) { acceptingWrites = false; return; }   // can't renew: step down\n    await sleep(2000);\n  }\n}\n"
    },
    {
      "title": "Traffic redirection is a routing layer, not the app",
      "kind": "infra",
      "explain": "Once the new primary is confirmed, clients need to find it — a floating virtual IP (VRRP/keepalived), a DNS record with a short TTL, or a proxy layer that watches the coordinator, are the usual mechanisms. The application code above never changes an IP address itself; it only flips a role."
    },
    {
      "title": "Replaying the write gap after recovery",
      "kind": "code",
      "explain": "When the old primary comes back, it's behind and must not simply resume as primary — it rejoins as a replica and catches up from the new primary's log before it's trusted with anything, otherwise it could reintroduce writes that were already superseded.",
      "code": "async function onRecoveredNodeRejoin(node) {\n  const lastKnownOffset = await node.log.tail();\n  await node.replicateFrom(currentPrimary, { fromOffset: lastKnownOffset });\n  node.role = 'replica';   // never re-promotes itself\n}\n"
    }
  ],
  "closing": "If they ask about active-active instead: it removes the failover pause entirely but trades it for needing conflict resolution on every write, not just during an outage — worth it only if the write conflict rate is low enough to make that cheap."
}
