{
  "schemaVersion": 1,
  "id": "hash-ring",
  "title": "Dry-run: a hash ring with virtual nodes",
  "intro": "About 5 minutes. Build the naive version first so the interviewer sees the failure, then fix it — that ordering is most of the score.",
  "language": "javascript",
  "steps": [
    {
      "title": "Show the problem before the solution",
      "kind": "code",
      "explain": "Write modulo routing first and demonstrate what a single failure does. Leading with the broken version proves you understand why the ring exists rather than that you memorised it.",
      "saysOutLoud": "Let me start with the obvious approach and show why it collapses.",
      "code": "const servers = ['s0', 's1', 's2', 's3'];\n\nconst route = (key) => servers[hash(key) % servers.length];\n\n// Drop s1 → the divisor changes → almost every key moves.\n// With N servers, removing one remaps roughly (N-1)/N of keys:\n//   4 servers → ~75%      10 servers → ~90%\n"
    },
    {
      "title": "Place servers on a ring instead",
      "kind": "code",
      "explain": "The key move: hash servers into the same space as keys. A server's position depends only on its own name, so it does not shift when other servers come and go — that independence is the entire trick.",
      "code": "// positions: sorted [{ hash, server }]\nconst ring = [];\n\nfunction addServer(name, vnodes = 150) {\n  for (let i = 0; i < vnodes; i++) {\n    ring.push({ hash: hash(`${name}#${i}`), server: name });\n  }\n  ring.sort((a, b) => a.hash - b.hash);\n}\n"
    },
    {
      "title": "Look up by walking clockwise",
      "kind": "code",
      "explain": "Binary search for the first position at or after the key's hash, wrapping at the end. O(log N) and entirely local — no network hop, which is why every client can hold the ring in memory instead of asking a central service.",
      "saysOutLoud": "Lookup is a binary search over a sorted array — no coordination on the read path.",
      "code": "function locate(key) {\n  const h = hash(key);\n\n  let lo = 0, hi = ring.length - 1;\n  while (lo < hi) {\n    const mid = (lo + hi) >> 1;\n    if (ring[mid].hash < h) lo = mid + 1;\n    else hi = mid;\n  }\n\n  // wrap past the end of the ring back to the first position\n  return ring[ring[lo].hash >= h ? lo : 0].server;\n}\n"
    },
    {
      "title": "Explain why 150 virtual nodes, not 1",
      "kind": "code",
      "explain": "Two reasons, and the second matters more in production. Even distribution is the obvious one. The real payoff is that a failed server's load is spread across every survivor instead of dumping entirely onto its single clockwise neighbour — which is what turns one node failure into a cascade.",
      "code": "// One token per server: load spread is wild, and losing a server\n// dumps its whole range onto ONE neighbour, which then falls over.\n//\n// Load spread shrinks roughly as 1/sqrt(V):\n//   V=1    → 2-4x imbalance is ordinary\n//   V=100  → ~10%\n//   V=1000 → ~3%\n//\n// 150 sits near the knee of that curve.\n"
    },
    {
      "title": "Replication falls out of the same walk",
      "kind": "code",
      "explain": "Keep walking for R distinct physical servers. 'Distinct' is load-bearing — a naive walk hands you the same machine repeatedly because it owns many positions, leaving you one copy where you wanted three. Production also skips racks and availability zones.",
      "code": "function preferenceList(key, r = 3) {\n  const start = indexOf(hash(key));\n  const chosen = [];\n\n  for (let i = 0; i < ring.length && chosen.length < r; i++) {\n    const s = ring[(start + i) % ring.length].server;\n    if (!chosen.includes(s)) chosen.push(s); // skip repeat positions\n  }\n  return chosen;\n}\n"
    },
    {
      "title": "Gossip keeps every client's ring in sync",
      "kind": "infra",
      "explain": "Membership spreads by gossip rather than a central registry, which means the ring is eventually consistent: during a change, two clients can briefly disagree about who owns a key. The storage layer absorbs that with replicas and read repair instead of trying to make membership instantaneous."
    },
    {
      "title": "Name what the ring does not fix",
      "kind": "code",
      "explain": "Get ahead of the standard follow-up. The ring balances key count, not traffic — one celebrity key still lands on one server and still melts it. Saying this unprompted shows you know the boundary of the technique.",
      "saysOutLoud": "Consistent hashing balances keys, not load — a hot key is a separate problem.",
      "code": "// Still broken by a single hot key:\n//   locate('celebrity:42')  → always the same server\n//\n// Fixes are separate from the ring:\n//   • replicate hot keys across several nodes\n//   • suffix-shard: 'celebrity:42#' + (rand % k)\n//   • put a cache in front\n"
    }
  ],
  "closing": "If they ask for something simpler: rendezvous hashing gives the same minimal-movement guarantee with no ring to maintain, at O(N) per lookup instead of O(log N). Fine for tens of servers, not for thousands."
}
